Warning: Using a password on the command line interface can be insecure.
--------------
CREATE VIEW P4Q1 AS SELECT firstname, lastname, tripname, country, money FROM passenger, bustrip, book WHERE passenger.passengerid = book.passengerid AND bustrip.tripid = book.tripid
--------------

Query OK, 0 rows affected (0.01 sec)

--------------
SELECT * FROM P4Q1
--------------

+-----------+----------+----------------------------+---------+--------+
| firstname | lastname | tripname                   | country | money  |
+-----------+----------+----------------------------+---------+--------+
| Homer     | Simpson  | Castles of Germany         | Germany |    500 |
| Marge     | Simpson  | Castles of Germany         | Germany |    500 |
| Bart      | Simpson  | Castles of Germany         | Germany |    200 |
| Lisa      | Simpson  | Castles of Germany         | Germany |    200 |
| Maggie    | Simpson  | Castles of Germany         | Germany |    200 |
| Heidi     | Klum     | Castles of Germany         | Germany | 600.99 |
| Dwight    | Schrute  | Castles of Germany         | Germany |    550 |
| Dwight    | Schrute  | Beaches Galore             | Bermuda |    600 |
| Creed     | Bratton  | Beaches Galore             | Bermuda |    600 |
| Homer     | Simpson  | Arrivaderci Roma           | Italy   |    600 |
| Marge     | Simpson  | Arrivaderci Roma           | Italy   |    600 |
| Bart      | Simpson  | Arrivaderci Roma           | Italy   |    100 |
| Lisa      | Simpson  | Arrivaderci Roma           | Italy   |    100 |
| Maggie    | Simpson  | Arrivaderci Roma           | Italy   |    100 |
| Homer     | Simpson  | Shetland and Orkney        | UK      |    300 |
| Ned       | Flanders | Shetland and Orkney        | UK      |    400 |
| Michael   | Scott    | Shetland and Orkney        | UK      |    500 |
| Bart      | Simpson  | Disney World and Sea World | USA     |    300 |
| Lisa      | Simpson  | Disney World and Sea World | USA     |    300 |
| Ned       | Flanders | Disney World and Sea World | USA     |    400 |
| Todd      | Flanders | Disney World and Sea World | USA     |    200 |
| Michael   | Jordan   | Trip to Cuba               | Cuba    |   1000 |
+-----------+----------+----------------------------+---------+--------+
22 rows in set (0.00 sec)

--------------
SELECT * FROM P4Q1 WHERE tripname LIKE '%Castles%' ORDER BY money
--------------

+-----------+----------+--------------------+---------+--------+
| firstname | lastname | tripname           | country | money  |
+-----------+----------+--------------------+---------+--------+
| Lisa      | Simpson  | Castles of Germany | Germany |    200 |
| Maggie    | Simpson  | Castles of Germany | Germany |    200 |
| Bart      | Simpson  | Castles of Germany | Germany |    200 |
| Homer     | Simpson  | Castles of Germany | Germany |    500 |
| Marge     | Simpson  | Castles of Germany | Germany |    500 |
| Dwight    | Schrute  | Castles of Germany | Germany |    550 |
| Heidi     | Klum     | Castles of Germany | Germany | 600.99 |
+-----------+----------+--------------------+---------+--------+
7 rows in set (0.00 sec)

--------------
SELECT * FROM bus
--------------

+--------------+----------+
| licenseplate | capacity |
+--------------+----------+
| CAND123      |       50 |
| TAXI111      |        4 |
| TAXI222      |        3 |
| TAXI333      |        4 |
| UWO1122      |       70 |
| UWO3311      |       62 |
| VAN1111      |       10 |
| VAN2222      |       15 |
+--------------+----------+
8 rows in set (0.00 sec)

--------------
DELETE FROM bus WHERE licenseplate LIKE '%UWO%'
--------------

Query OK, 2 rows affected (0.01 sec)

--------------
SELECT * FROM bus
--------------

+--------------+----------+
| licenseplate | capacity |
+--------------+----------+
| CAND123      |       50 |
| TAXI111      |        4 |
| TAXI222      |        3 |
| TAXI333      |        4 |
| VAN1111      |       10 |
| VAN2222      |       15 |
+--------------+----------+
6 rows in set (0.00 sec)

--------------
SELECT * FROM passport
--------------

+-------------+------------+-------------+------------+-------------+
| passportnum | expirydate | citizenship | birthdate  | passengerid |
+-------------+------------+-------------+------------+-------------+
| GE11        | 2027-01-01 | Germany     | 1970-07-12 |          66 |
| US10        | 2025-01-01 | USA         | 1970-02-19 |          11 |
| US12        | 2025-01-01 | USA         | 1972-08-12 |          22 |
| US13        | 2025-01-01 | USA         | 2001-05-12 |          33 |
| US14        | 2025-01-01 | USA         | 2004-03-19 |          34 |
| US15        | 2025-01-01 | USA         | 2012-09-17 |          35 |
| US22        | 2030-04-04 | USA         | 1950-06-11 |          44 |
| US23        | 2018-03-03 | USA         | 1940-06-24 |          45 |
| US45        | 2099-01-01 | USA         | 1999-07-15 |          99 |
| US88        | 2030-02-13 | Canada      | 1979-04-25 |          77 |
| US89        | 2022-02-02 | Germany     | 1976-04-08 |          78 |
| US90        | 2020-02-28 | Italy       | 1980-04-04 |          79 |
| US91        | 2030-01-01 | Germany     | 1959-02-02 |          80 |
+-------------+------------+-------------+------------+-------------+
13 rows in set (0.00 sec)

--------------
SELECT * FROM passenger
--------------

+-------------+-----------+----------+
| passengerid | firstname | lastname |
+-------------+-----------+----------+
|          11 | Homer     | Simpson  |
|          22 | Marge     | Simpson  |
|          33 | Bart      | Simpson  |
|          34 | Lisa      | Simpson  |
|          35 | Maggie    | Simpson  |
|          44 | Ned       | Flanders |
|          45 | Todd      | Flanders |
|          66 | Heidi     | Klum     |
|          77 | Michael   | Scott    |
|          78 | Dwight    | Schrute  |
|          79 | Pam       | Beesly   |
|          80 | Creed     | Bratton  |
|          99 | Michael   | Jordan   |
+-------------+-----------+----------+
13 rows in set (0.01 sec)

--------------
DELETE FROM passport WHERE citizenship ='Canada'
--------------

Query OK, 1 row affected (0.01 sec)

--------------
SELECT * FROM passport
--------------

+-------------+------------+-------------+------------+-------------+
| passportnum | expirydate | citizenship | birthdate  | passengerid |
+-------------+------------+-------------+------------+-------------+
| GE11        | 2027-01-01 | Germany     | 1970-07-12 |          66 |
| US10        | 2025-01-01 | USA         | 1970-02-19 |          11 |
| US12        | 2025-01-01 | USA         | 1972-08-12 |          22 |
| US13        | 2025-01-01 | USA         | 2001-05-12 |          33 |
| US14        | 2025-01-01 | USA         | 2004-03-19 |          34 |
| US15        | 2025-01-01 | USA         | 2012-09-17 |          35 |
| US22        | 2030-04-04 | USA         | 1950-06-11 |          44 |
| US23        | 2018-03-03 | USA         | 1940-06-24 |          45 |
| US45        | 2099-01-01 | USA         | 1999-07-15 |          99 |
| US89        | 2022-02-02 | Germany     | 1976-04-08 |          78 |
| US90        | 2020-02-28 | Italy       | 1980-04-04 |          79 |
| US91        | 2030-01-01 | Germany     | 1959-02-02 |          80 |
+-------------+------------+-------------+------------+-------------+
12 rows in set (0.00 sec)

--------------
SELECT * FROM passenger
--------------

+-------------+-----------+----------+
| passengerid | firstname | lastname |
+-------------+-----------+----------+
|          11 | Homer     | Simpson  |
|          22 | Marge     | Simpson  |
|          33 | Bart      | Simpson  |
|          34 | Lisa      | Simpson  |
|          35 | Maggie    | Simpson  |
|          44 | Ned       | Flanders |
|          45 | Todd      | Flanders |
|          66 | Heidi     | Klum     |
|          77 | Michael   | Scott    |
|          78 | Dwight    | Schrute  |
|          79 | Pam       | Beesly   |
|          80 | Creed     | Bratton  |
|          99 | Michael   | Jordan   |
+-------------+-----------+----------+
13 rows in set (0.00 sec)

--------------
SELECT * FROM bustrip
--------------

+--------+------------+------------+---------+----------------------------+--------------+
| tripid | startdate  | enddate    | country | tripname                   | licenseplate |
+--------+------------+------------+---------+----------------------------+--------------+
|      1 | 2022-01-01 | 2022-01-17 | Germany | Castles of Germany         | VAN1111      |
|      2 | 2022-03-03 | 2022-03-14 | Italy   | Tuscany Sunsets            | TAXI222      |
|      3 | 2022-05-05 | 2022-05-10 | USA     | California Wines           | VAN1111      |
|      4 | 2022-04-04 | 2022-04-14 | Bermuda | Beaches Galore             | TAXI222      |
|      5 | 2022-06-01 | 2022-06-22 | Canada  | Cottage Country            | CAND123      |
|      6 | 2022-07-05 | 2022-07-15 | Italy   | Arrivaderci Roma           | TAXI111      |
|      7 | 2022-09-09 | 2022-09-29 | UK      | Shetland and Orkney        | TAXI111      |
|      8 | 2022-06-10 | 2022-06-20 | USA     | Disney World and Sea World | VAN1111      |
|      9 | 2018-06-10 | 2018-06-20 | Japan   | Trip of Tokyo              | VAN2222      |
|     10 | 2019-06-10 | 2019-06-20 | Cuba    | Trip to Cuba               | VAN2222      |
+--------+------------+------------+---------+----------------------------+--------------+
10 rows in set (0.00 sec)

--------------
DELETE FROM bustrip WHERE tripname = 'California Wines'
--------------

Query OK, 1 row affected (0.02 sec)

--------------
SELECT * FROM bustrip
--------------

+--------+------------+------------+---------+----------------------------+--------------+
| tripid | startdate  | enddate    | country | tripname                   | licenseplate |
+--------+------------+------------+---------+----------------------------+--------------+
|      1 | 2022-01-01 | 2022-01-17 | Germany | Castles of Germany         | VAN1111      |
|      2 | 2022-03-03 | 2022-03-14 | Italy   | Tuscany Sunsets            | TAXI222      |
|      4 | 2022-04-04 | 2022-04-14 | Bermuda | Beaches Galore             | TAXI222      |
|      5 | 2022-06-01 | 2022-06-22 | Canada  | Cottage Country            | CAND123      |
|      6 | 2022-07-05 | 2022-07-15 | Italy   | Arrivaderci Roma           | TAXI111      |
|      7 | 2022-09-09 | 2022-09-29 | UK      | Shetland and Orkney        | TAXI111      |
|      8 | 2022-06-10 | 2022-06-20 | USA     | Disney World and Sea World | VAN1111      |
|      9 | 2018-06-10 | 2018-06-20 | Japan   | Trip of Tokyo              | VAN2222      |
|     10 | 2019-06-10 | 2019-06-20 | Cuba    | Trip to Cuba               | VAN2222      |
+--------+------------+------------+---------+----------------------------+--------------+
9 rows in set (0.00 sec)

--------------
DELETE FROM bustrip WHERE tripname = 'Arrivaderci Roma'
--------------

Query OK, 1 row affected (0.01 sec)

--------------
SELECT * FROM passenger
--------------

+-------------+-----------+----------+
| passengerid | firstname | lastname |
+-------------+-----------+----------+
|          11 | Homer     | Simpson  |
|          22 | Marge     | Simpson  |
|          33 | Bart      | Simpson  |
|          34 | Lisa      | Simpson  |
|          35 | Maggie    | Simpson  |
|          44 | Ned       | Flanders |
|          45 | Todd      | Flanders |
|          66 | Heidi     | Klum     |
|          77 | Michael   | Scott    |
|          78 | Dwight    | Schrute  |
|          79 | Pam       | Beesly   |
|          80 | Creed     | Bratton  |
|          99 | Michael   | Jordan   |
+-------------+-----------+----------+
13 rows in set (0.00 sec)

--------------
DELETE FROM passenger WHERE firstname = 'Pam'
--------------

Query OK, 1 row affected (0.04 sec)

--------------
SELECT * FROM passenger
--------------

+-------------+-----------+----------+
| passengerid | firstname | lastname |
+-------------+-----------+----------+
|          11 | Homer     | Simpson  |
|          22 | Marge     | Simpson  |
|          33 | Bart      | Simpson  |
|          34 | Lisa      | Simpson  |
|          35 | Maggie    | Simpson  |
|          44 | Ned       | Flanders |
|          45 | Todd      | Flanders |
|          66 | Heidi     | Klum     |
|          77 | Michael   | Scott    |
|          78 | Dwight    | Schrute  |
|          80 | Creed     | Bratton  |
|          99 | Michael   | Jordan   |
+-------------+-----------+----------+
12 rows in set (0.00 sec)

--------------
SELECT * FROM P4Q1
--------------

+-----------+----------+----------------------------+---------+--------+
| firstname | lastname | tripname                   | country | money  |
+-----------+----------+----------------------------+---------+--------+
| Homer     | Simpson  | Castles of Germany         | Germany |    500 |
| Marge     | Simpson  | Castles of Germany         | Germany |    500 |
| Bart      | Simpson  | Castles of Germany         | Germany |    200 |
| Lisa      | Simpson  | Castles of Germany         | Germany |    200 |
| Maggie    | Simpson  | Castles of Germany         | Germany |    200 |
| Heidi     | Klum     | Castles of Germany         | Germany | 600.99 |
| Dwight    | Schrute  | Castles of Germany         | Germany |    550 |
| Dwight    | Schrute  | Beaches Galore             | Bermuda |    600 |
| Creed     | Bratton  | Beaches Galore             | Bermuda |    600 |
| Homer     | Simpson  | Shetland and Orkney        | UK      |    300 |
| Ned       | Flanders | Shetland and Orkney        | UK      |    400 |
| Michael   | Scott    | Shetland and Orkney        | UK      |    500 |
| Bart      | Simpson  | Disney World and Sea World | USA     |    300 |
| Lisa      | Simpson  | Disney World and Sea World | USA     |    300 |
| Ned       | Flanders | Disney World and Sea World | USA     |    400 |
| Todd      | Flanders | Disney World and Sea World | USA     |    200 |
| Michael   | Jordan   | Trip to Cuba               | Cuba    |   1000 |
+-----------+----------+----------------------------+---------+--------+
17 rows in set (0.00 sec)

--------------
DELETE FROM passenger WHERE lastname = 'Simpson'
--------------

Query OK, 5 rows affected (0.01 sec)

--------------
SELECT * FROM P4Q1
--------------

+-----------+----------+----------------------------+---------+--------+
| firstname | lastname | tripname                   | country | money  |
+-----------+----------+----------------------------+---------+--------+
| Heidi     | Klum     | Castles of Germany         | Germany | 600.99 |
| Dwight    | Schrute  | Castles of Germany         | Germany |    550 |
| Dwight    | Schrute  | Beaches Galore             | Bermuda |    600 |
| Creed     | Bratton  | Beaches Galore             | Bermuda |    600 |
| Ned       | Flanders | Shetland and Orkney        | UK      |    400 |
| Michael   | Scott    | Shetland and Orkney        | UK      |    500 |
| Ned       | Flanders | Disney World and Sea World | USA     |    400 |
| Todd      | Flanders | Disney World and Sea World | USA     |    200 |
| Michael   | Jordan   | Trip to Cuba               | Cuba    |   1000 |
+-----------+----------+----------------------------+---------+--------+
9 rows in set (0.00 sec)

Bye
